{
  "taskId": "task-2026-10-10-001",
  "actionId": "action-001",
  "planHash": "94024d16440b2ec90a36dbbc102852cd9ff9ea41bbf0a5894a79ad0e9b36452c",
  "policySnapshotRevision": "pol-snap-2026-10-10-a",
  "authorizationKind": "AUTOMATIC",
  "authorizationRef": "grant-2026-10-10-001",
  "expiresAt": "2026-10-10T08:30:00.000Z",
  "action": {
    "actionId": "action-001",
    "bindingRef": "binding-imagemagick-localwin",
    "op": "image.resize",
    "parameters": { "format": "JPG", "maxLongEdgePx": 1600 },
    "sideEffectClass": "R1",
    "requiredPrivilege": "NONE",
    "filesystemScope": {
      "read": ["C:\\fixtures\\images"],
      "write": ["C:\\fixtures\\out"]
    },
    "networkScope": { "allowed": false },
    "timeoutMs": 600000,
    "cancellation": { "supported": true, "mode": "COOPERATIVE" },
    "expectedState": { "count": 12, "outputsDecode": true }
  }
}
